title,abstract,similarity
Lionel Messi Names the Best Striker He Ever Saw,"Barcelona star ​Lionel Messi has picked the Brazilian Ronaldo as the greatest striker he has ever seen. The Argentinean wizard, who has in the running for his sixth Ballon d'Or this year, was quizzed on several topics when speaking to TyC Sports, which included the topic of who his favourite striker. As quoted by ​AS, Messi replied to a question asking who he thought is the best striker in footballing history: ""Ronaldo [Nazario] was a...",0.3025117454021158
How should Liverpool and Egypt manage Salah injury?,Both club and country are sweating the fitness of the star forward.,0.275740835229742
La Liga roundup: Messi ties Ronaldo's La Liga hat-trick record (video),Lionel Messi has recorded 34 hat tricks in 459 La Liga appearances.,0.25657153531340654
"Barcelona 4-1 Celta Vigo: Report, Ratings & Reaction as Messi Hat-Trick Sends Barca Top of La Liga","Liga Barcelona put a rough week behind them with an emphatic victory over Celta Vigo on Saturday, Lionel Messi scoring a sumptuous hat trick to send his side back to the top of La Liga. After a tentative start, Celta defender Aidoo unintentionally handled the ball in the area in the 22nd minute, allowing Messi to score the first of the night and the 610th of his senior club career. The little Argentine was 'as cool as a polar bear's backside',...",0.24537172689778913
Liverpool Receive Update on Severity of Mohamed Salah's Ankle Injury,"​Liverpool forward Mohamed Salah is reportedly a doubt to face Crystal Palace after the international break following a reoccurrence of an ankle injury sustained in their 3-1 win over Manchester City. The 27-year-old was on the receiving end of a strong challenge by City's Fernandinho in the first half and required treatment, but was able to continue until he was eventually substituted in the 87th minute. While he was able to play on, ​Th​e...",0.24300299098468872
